{
	"id": "7a1c2e3f-4b5d-4e6f-8a7b-9c0d1e2f3a40",
	"organizationId": "0f4b2c6d-8e1a-4b3c-9d5e-6f7a8b9c0d12",
	"version": 3,
	"createdAt": "2026-10-16T09:00:00.000Z",
	"updatedAt": "2026-10-16T09:30:00.000Z",
	"scope": {
		"type": "organization",
		"id": "0f4b2c6d-8e1a-4b3c-9d5e-6f7a8b9c0d12"
	},
	"workId": null,
	"folderId": "8b2d3f40-5c6e-4f70-9b8c-0d1e2f3a4b51",
	"path": "support/refund-policy.md",
	"slug": "refund-policy",
	"title": "Refund policy",
	"description": "How support handles refunds.",
	"class": "freeform",
	"tags": ["support", "billing"],
	"categories": [],
	"status": "active",
	"reviewState": "accepted",
	"locked": false,
	"lockMode": null,
	"language": "en",
	"source": "imported",
	"body": "# Refund policy\n\nRefunds within 30 days. See [[support/escalation.md]].",
	"revision": 2,
	"revisionAt": "2026-10-16T09:30:00.000Z",
	"normalizedContentHash": "5d41402abc4b2a76b9719d911017c592a1f8f1c0a7b3e3c4d5e6f7a8b9c0d1e2",
	"decision": null,
	"createdById": "2b6d4e8f-0a3c-4d5e-9f71-8b9c0d1e2f30",
	"updatedById": "2b6d4e8f-0a3c-4d5e-9f71-8b9c0d1e2f30",
	"archivedAt": null,
	"wordCount": 9,
	"webUrl": "https://app.ever.works/memory?view=library"
}
